{
  "episodes": 3000,
  "max_steps_per_episode": 3000,
  "gamma": 0.99,
  "learning_rate": 0.0001,
  "weight_decay": 1e-05,
  "batch_size": 1,
  "replay_capacity": 50000,
  "min_replay_size": 3000,
  "train_frequency": 4,
  "target_update_interval": 2000,
  "grad_clip_norm": 5.0,
  "epsilon_start": 1.0,
  "epsilon_end": 0.03,
  "epsilon_decay_steps": 200000,
  "eval_episodes": 20,
  "moving_avg_window": 100,
  "log_interval": 10,
  "checkpoint_interval": 99999,
  "run_name": "curriculum_replay_migration",
  "output_root": "runs_smoke",
  "live_plot": false,
  "tensorboard": false,
  "save_csv": false,
  "save_jsonl": false,
  "device": "auto",
  "model_type": "adaptive_cnn",
  "local_patch_size": 11,
  "curriculum": {
    "stages": [
      {
        "board_size": 8,
        "episodes": 1,
        "max_steps_without_food": 200,
        "epsilon_start": 1.0,
        "epsilon_end": 0.08,
        "epsilon_decay_steps": 40000,
        "replay_capacity": 8,
        "min_replay_size": 1
      },
      {
        "board_size": 10,
        "episodes": 1,
        "max_steps_without_food": 200,
        "epsilon_start": 0.4,
        "epsilon_end": 0.06,
        "epsilon_decay_steps": 80000,
        "replay_capacity": 16,
        "min_replay_size": 1
      }
    ],
    "carry_replay": true,
    "scale_timeout": true
  },
  "random_board": null,
  "env": {
    "difficulty": "normal",
    "mode": "classic",
    "board_size": 14,
    "enable_bonus_food": false,
    "enable_obstacles": false,
    "allow_leveling": false,
    "max_steps_without_food": 196,
    "seed": 42
  }
}